<?xml version="1.0" encoding="UTF-8" standalone="no"?>
<!DOCTYPE student PUBLIC "-//Portland State University//DTD CS410J Grade Book//EN" "http://www.cs.pdx.edu/~whitlock/dtds/gradebook.dtd">
<student enrolled-section="undergraduate">
<id>studentId</id>
<firstName>FirstName</firstName>
<lastName>LastName</lastName>
<email>email@email.edu</email>
<ssn>123456789</ssn>
<major>CS</major>
<d2l-id>D2L</d2l-id>
</student>
