<?xml version="1.0" encoding="UTF-8" standalone="no"?>
<!DOCTYPE student PUBLIC "-//Portland State University//DTD CS410J Grade Book//EN" "http://www.cs.pdx.edu/~whitlock/dtds/gradebook.dtd">
<student enrolled-section="graduate">
<id>studentId</id>
<firstName>FirstName</firstName>
<lastName>LastName</lastName>
<email>email@email.com</email>
<major>Major</major>
<grades>
<grade>
<name>Project2</name>
<score>8.0</score>
<submissions>
<submission>2021-07-15T14:32:33.180122476</submission>
<submission>2021-07-18T20:46:31.149349812</submission>
<submission>2021-07-18T21:07:10.470503273</submission>
</submissions>
</grade>
</grades>
<late>
<name>Project2</name>
<name>Project2</name>
<name>Project2</name>
</late>
</student>
